{
  "mechanism": {
    "type": "plist_key",
    "identifier": "com.apple.applicationaccess:allowCloudKeychainSync",
    "data_type": "boolean",
    "secure_value": false,
    "current_default": null
  },
  "platform": "macos",
  "applicability_tags": ["enterprise", "high_security", "byod", "regulated_environment"],
  "rationale_tags": ["prevents_credential_exposure", "prevents_data_exfiltration"],
  "description_intent": "iCloud Keychain sync is a replication feature: whatever the local keychain is currently holding for a signed-in Apple Account gets copied up and reappears on every other device signed into that same account, without regard to whose account it happens to be. The plist key at the center of this control is a single on/off switch for that replication path - setting it false stops copies from leaving the device through this channel at all, while leaving it unset or true keeps the path open. The benchmark states no fixed target for this key and leaves the choice to the organization's own policy; this spec records false as the hardening direction, on the basis that closing a replication channel is what actually reduces what can leave the device's boundary.",
  "rationale_intent": "Every credential this feature copies off the device gains a second home outside the boundary the organization can inspect or revoke on its own terms - the data doesn't stop existing locally when it syncs, it simply exists somewhere else too, indefinitely, alongside whatever else that Apple Account happens to touch. That's a straightforward trade: the convenience of not re-entering a password on a second device, against a duplicate of that same password sitting in an account the organization may not own, administer, or even know the contents of. Closing the replication path removes that second copy from the equation entirely, so whatever protections apply to the device itself are the only protections that have to hold - rather than being one of two places the same secret has to stay safe.",
  "framework_mapping_refs": [
    {
      "framework": "cis",
      "framework_product": "macos_26_tahoe",
      "control_id": "2.1.1.1",
      "framework_version": "1.1.0",
      "framework_level": ["Level 2"],
      "checked_date": "2026-08-25"
    }
  ],
  "control_surface": "device_config_profile",
  "management_channels": ["macos_profile"]
}
